{
  "name": "computeTotal",
  "inputType": "Order",
  "inputFields": ["total", "shipping"],
  "params": [],
  "assigns": [
    {
      "fieldName": "total",
      "value": {
        "arith": {
          "op": "add",
          "left": {"field": {"name": "shipping"}},
          "right": {"lit": 100}
        }
      }
    }
  ]
}
